"Authors","Author full names","Author(s) ID","Title","Year","Source title","Volume","Issue","Art. No.","Page start","Page end","Page count","Cited by","DOI","Link","Abstract","Author Keywords","Index Keywords","Document Type","Publication Stage","Open Access","Source","EID"
"Chen C.-H.; Chen Y.-H.; Wu M.-E.","Chen, Chun-Hao (57211067310); Chen, Yu-Hsuan (57195557562); Wu, Mu-En (18635615600)","57211067310; 57195557562; 18635615600","A GGA-based algorithm for group trading strategy portfolio optimization","2017","ACM International Conference Proceeding Series","Part F129682","","3092135","","","","2","10.1145/3092090.3092135","https://www.scopus.com/inward/record.uri?eid=2-s2.0-85028754138&doi=10.1145%2f3092090.3092135&partnerID=40&md5=d9a445de87e77f4dc6c85a4123d91617","To have more flexible trading strategy portfolio, in this paper, we define a group trading strategy portfolio and then propose an approach to optimize it using the grouping genetic algorithm. In the proposed approach, each chromosome encodes a group trading strategy portfolio by the grouping, strategy and weight parts. The fitness function composes of group balance, weight balance, profit factor, and risk factor is designed to evaluate quality of each chromosome. Genetic operations are applied on population to generate new chromosomes. Evolution is repeated until termination condition is reached. At last, experiments on a real dataset were also conducted to show the effectiveness of the proposed approach. © 2017 ACM.","Group trading strategy portfolio; Grouping genetic algorithm; Portfolio optimization; Trading strategy; Trading strategy portfolio","Chromosomes; Commerce; Financial data processing; Genetic algorithms; Optimization; Fitness functions; Genetic operations; Grouping genetic algorithms; Portfolio optimization; Profit factors; Termination condition; Trading strategies; Weight balance; Electronic trading","Conference paper","Final","","Scopus","2-s2.0-85028754138"
"Yevseyeva I.; Guerreiro A.P.; Emmerich M.T.M.; Fonseca C.M.","Yevseyeva, Iryna (22137230600); Guerreiro, Andreia P. (37079083600); Emmerich, Michael T. M. (14033942100); Fonseca, Carlos M. (56006891400)","22137230600; 37079083600; 14033942100; 56006891400","A portfolio optimization approach to selection in multiobjective evolutionary algorithms","2014","Lecture Notes in Computer Science (including subseries Lecture Notes in Artificial Intelligence and Lecture Notes in Bioinformatics)","8672","","","672","681","9","25","10.1007/978-3-319-10762-2_66","https://www.scopus.com/inward/record.uri?eid=2-s2.0-84921746561&doi=10.1007%2f978-3-319-10762-2_66&partnerID=40&md5=1f18e4968bcfaf650c528dc42e9433d4","In this work, a new approach to selection in multiobjective evolutionary algorithms (MOEAs) is proposed. It is based on the portfolio selection problem, which is well known in financial management. The idea of optimizing a portfolio of investments according to both expected return and risk is transferred to evolutionary selection, and fitness assignment is reinterpreted as the allocation of capital to the individuals in the population, while taking into account both individual quality and population diversity. The resulting selection procedure, which unifies parental and environmental selection, is instantiated by defining a suitable notion of (random) return for multiobjective optimization. Preliminary experiments on multiobjective multidimensional knapsack problem instances show that such a procedure is able to preserve diversity while promoting convergence towards the Pareto-optimal front. © Springer International Publishing Switzerland 2014.","Evolutionary algorithms; Fitness assignment; Multiobjective knapsack problem; Portfolio selection; Sharpe ratio","Combinatorial optimization; Evolutionary algorithms; Financial data processing; Genetic algorithms; Pareto principle; Multiobjective optimization; Optimization; Problem solving; Fitness assignment; Knapsack problems; Multidimensional knapsack problems; Multiobjective evolutionary algorithms; Portfolio optimization; Portfolio selection; Portfolio selection problems; Sharpe ratios; Multiobjective optimization; Evolutionary algorithms","Article","Final","","Scopus","2-s2.0-84921746561"
"Kumar D.; Mishra K.K.","Kumar, Divya (36699884700); Mishra, K.K. (7101737764)","36699884700; 7101737764","Portfolio optimization using novel co-variance guided Artificial Bee Colony algorithm","2017","Swarm and Evolutionary Computation","33","","","119","130","11","57","10.1016/j.swevo.2016.11.003","https://www.scopus.com/inward/record.uri?eid=2-s2.0-85007210029&doi=10.1016%2fj.swevo.2016.11.003&partnerID=40&md5=d8ec88e06088aef7b2fa8c16baf2a11d","Although the use of evolutionary algorithms and fuzzy logic for portfolio optimization is an established research area, this field remains fascinating because of its important financial aspects. The field is brisk and it trances as there always remain research issues which are yet to explore. The problem of portfolio optimization comprises of finding an optimal distribution of funds among various available securities so as to maximize the return and minimize the risk. Artificial Bee Colony (ABC) is one of the effectual and widely used optimization technique based on swarm intelligence. Mixing co-variance principles with ABC algorithm assists in quick convergence with more precision. This paper presents a novel co-variance guided Artificial Bee Colony algorithm for portfolio optimization. As portfolio optimization consists of simultaneous optimization of multiple conflicting objectives, this algorithm is named as Multi-objective Co-variance based ABC (M-CABC). The efficacy of the proposed algorithm is tested on benchmark problems of portfolio optimization from the OR-library. The results validate the adept performance of the proposed algorithm in finding various optimal trade-off solutions simultaneously handling realistic constraints. The article concludes with exhaustive post-result analysis and observatory remarks to bring out some of the crucial properties of optimal portfolios. © 2016 Elsevier B.V.","Artificial Bee Colony; Co-variance; Multi-objective problem; Non-dominatedsorting; Optimization; Pareto-front; Portfolio; Return; Risk","Economic and social effects; Electronic trading; Evolutionary algorithms; Financial data processing; Financial markets; Fuzzy logic; Multiobjective optimization; Risks; Artificial bee colonies; Co-variance; Multi-objective problem; Non-dominatedsorting; Pareto front; Portfolio; Return; Optimization","Article","Final","","Scopus","2-s2.0-85007210029"
"Shylo V.P.; Shylo O.V.","Shylo, Volodymyr P. (6701444074); Shylo, Oleg V. (14122367200)","6701444074; 14122367200","Algorithm portfolios and teams in parallel optimization","2017","Springer Optimization and Its Applications","130","","","481","493","12","1","10.1007/978-3-319-68640-0_23","https://www.scopus.com/inward/record.uri?eid=2-s2.0-85042415440&doi=10.1007%2f978-3-319-68640-0_23&partnerID=40&md5=d8b6b76f99dbf0918965a11f59cb19f0","Parallel computing systems are readily available to optimization experts in industry and academia, providing tools for solving optimization models of unprecedented scale. Unfortunately, there is no simple way to adapt existing optimization theory and algorithms to fully realize the distributed power of these systems, preventing their widespread usage. At the same time, optimization models that fully capture the essence of industrial scale problems, such as stochastic conditions and outcomes, multi-stage structure, and multi-objective criteria, require capacities only afforded by parallel computing. Without efficient and scalable parallel methods we are unable to utilize these computational resources. This chapter outlines these challenges and illustrates theoretical extensions to deal with such limitations. © Springer International Publishing AG 2017.","","","Book chapter","Final","","Scopus","2-s2.0-85042415440"
"Pinto J.M.; Neves R.F.; Horta N.","Pinto, José Matias (48161855700); Neves, Rui Ferreira (15623594900); Horta, Nuno (6602200012)","48161855700; 15623594900; 6602200012","Multi-objective optimization of trading strategies using genetic algorithms in unstable environments","2015","New Developments in Evolutionary Computation Research","","","","1","71","70","0","","https://www.scopus.com/inward/record.uri?eid=2-s2.0-84955734946&partnerID=40&md5=6b809992f4e96e07f1f6129ca0effba6","Time-ordered sequences of data (Time Series data), have arisen across a broad range of applications in nearly all domains. In this study, extensive experiments using real-world data obtained from one of the most dynamic environments is used - Financial Markets. Additionally, a Multi-Objective Evolutionary System is used to predict future asset price evolution. Therefore, in this study, a Genetic Algorithm (GA)-based Multi-Objective Evolutionary System to optimize a Trading or Investment Strategy (TS) was developed. The goal was to determine potential buy, sell, or hold conditions in stock markets while still yielding high returns at a minimal risk. Fair and established metrics were used (as described in the text) to evaluate both the returns and the linked risk of the optimized TS. Additionally, these TS are evaluated in several markets using data from the main stock indexes of the most developed economies, such as: NASDAQ, S&P 500, FTSE 100, DAX 30, and the NIKKEI 225. The Pareto Fronts obtained with the training data during the experiments clearly showed the inherent tradeoff between risk and return in financial management. Furthermore, the achieved results clearly outperformed both the B&H and S&H strategies. Regardless, the experimental results suggest that the positive connection between the gains for training data and test data, which was usually implied in the single-objective proposals, may not necessarily hold true in all circumstances. Due to the fact that the objective in this kind of problem is to find the best (optimized) solution to conduct investment in stock markets, this chapter will begin with a review of the most recent advances in Computational Problem Solving Techniques, as well as the traditional ones. In this review, the various existing techniques of Intelligent Computing currently used to solve various optimization problems are presented. The various existing techniques, especially in the fields of time series forecast and systems that learn by example, are briefly reviewed. © 2015 Nova Science Publishers, Inc.","Dynamic Systems; Financial Markets; Moving Average; Multi-Objective Optimization; Stock Market Prediction; Technical Analysis","Dynamical systems; Economics; Electronic trading; Evolutionary algorithms; Finance; Financial data processing; Forecasting; Genetic algorithms; Intelligent computing; Investments; Multiobjective optimization; Optimization; Problem solving; Time series; Computational problem; Financial managements; Moving averages; Multi-objective evolutionary; Optimization problems; Stock market prediction; Technical analysis; Time-ordered sequences; Financial markets","Book chapter","Final","","Scopus","2-s2.0-84955734946"
"Chen C.-H.; Shen W.-Y.; Hong T.-P.; Su J.-H.","Chen, Chun-Hao (57211067310); Shen, Wan-Yi (57196010883); Hong, Tzung-Pei (7202830492); Su, Ja-Hwung (16040552400)","57211067310; 57196010883; 7202830492; 16040552400","An island-based algorithm for group stock portfolio optimization","2017","IFSA-SCIS 2017 - Joint 17th World Congress of International Fuzzy Systems Association and 9th International Conference on Soft Computing and Intelligent Systems","","","8023354","","","","3","10.1109/IFSA-SCIS.2017.8023354","https://www.scopus.com/inward/record.uri?eid=2-s2.0-85030858172&doi=10.1109%2fIFSA-SCIS.2017.8023354&partnerID=40&md5=3a634cdbbbd7283964130130c75d8a99","This paper presents an island-based optimization approach to speed up the evaluation process for optimizing a diverse group stock portfolio which can provide various chooses for users to make investment decisions. It first initializes a population for each island. For every t generation, the best chromosome of each island is selected and putted into a master island. Then, chromosomes in master island will migrate to other islands in order to get a near optimal solution. Experimental results on a real dataset were also conducted and indicated that the proposed approach is better than the previous approach in terms of evolution time and returns of the optimized stock portfolios. © 2017 IEEE.","group stock portfolio; grouping genetic algorithm; grouping problem; island-based grouping genetic algorithm; portfolio optimization problem","Chromosomes; Financial data processing; Fuzzy systems; Genetic algorithms; Intelligent computing; Intelligent systems; Investments; Multivariable control systems; Soft computing; Evolution time; Grouping genetic algorithms; Grouping problem; Investment decisions; Near-optimal solutions; Optimization approach; Portfolio optimization; Stock portfolio; Optimization","Conference paper","Final","","Scopus","2-s2.0-85030858172"
"Gong C.; Xu C.; Ando M.","Gong, Chao (57191095840); Xu, Chunhui (55245057300); Ando, Masakazu (57191088893)","57191095840; 55245057300; 57191088893","Portfolio optimization in single-period under cumulative prospect theory using genetic algorithms and bootstrap method","2016","2016 13th International Conference on Service Systems and Service Management, ICSSSM  2016","","","7538542","","","","2","10.1109/ICSSSM.2016.7538542","https://www.scopus.com/inward/record.uri?eid=2-s2.0-84986551002&doi=10.1109%2fICSSSM.2016.7538542&partnerID=40&md5=172b63173b7739c722a21f2f2b6672ce","Cumulative prospect theory (CPT) has become one of the most popular approaches for evaluating the behavior of decision makers under conditions of uncertainty. Substantial experimental evidence suggests that human behavior may significantly deviate from the traditional expected utility maximization framework when faced with uncertainty. The problem of portfolio selection should be revised when the investor's preference is for CPT instead of expected utility theory (EUT). However, because of the complexity of the CPT function, little research has investigated the portfolio choice problem based on CPT. In this paper, we present an approach to solve the portfolio optimization in single-period under cumulative prospect theory, based upon the coupling of genetic algorithms with bootstrap method. The computational experiments show that the behavior characteristics of CPT investors when they faced the portfolio composed of risky assets by using the method we proposed. Finally, these phenomena are discussed in this paper. © 2016 IEEE.","bootstrap method; Cumulative prospect theory; genetic algorithms; portfolio optimization","Algorithms; Behavioral research; Decision making; Decision theory; Financial data processing; Genetic algorithms; Behavior characteristic; Bootstrap method; Computational experiment; Cumulative prospect theory; Expected utility theory; Experimental evidence; Portfolio optimization; Portfolio selection; Optimization","Conference paper","Final","","Scopus","2-s2.0-84986551002"
"Liao B.-Y.; Chen H.-W.; Kuo S.-Y.; Chou Y.-H.","Liao, Bo-Yu (57188980865); Chen, He-Wen (57188977390); Kuo, Shu-Yu (55557524100); Chou, Yao-Hsin (17345016900)","57188980865; 57188977390; 55557524100; 17345016900","Portfolio Optimization Based on Novel Risk Assessment Strategy with Genetic Algorithm","2016","Proceedings - 2015 IEEE International Conference on Systems, Man, and Cybernetics, SMC 2015","","","7379630","2861","2866","5","10","10.1109/SMC.2015.498","https://www.scopus.com/inward/record.uri?eid=2-s2.0-84964509931&doi=10.1109%2fSMC.2015.498&partnerID=40&md5=d3e099ec213e2ad3db0d25161ceaaaad","Stock selection is an important issue when it comes to investing in the stock market. However, it is worth investigating the problem of selecting portfolios while considering not only low risk but also high return on investment. The calculation process of the traditional method is highly complex and is not comprehensive in terms of what it takes into consideration. Hence, this paper proposes a new method to calculate portfolio risk. We utilize funds standardization in order to consider the risk of a portfolio and drastically reduce computation complexity. Funds standardization is able to represent fluctuations of investor mood. Moreover, using a Genetic algorithm (GA) combined with the Sharpe Ratio is able to identify the low risk and stable returns of a portfolio. Moreover, over-fitting is a common problem in the stock market, and so this paper uses sliding windows to avoid the over-fitting problem, and tests all kinds of training periods and testing periods that impact on the portfolio. The experimental results show that the proposed method, compared with the traditional method of calculating risk, is able to identify the optimal portfolio and performs efficiently and outstandingly when it comes to this problem. © 2015 IEEE.","Funds Standardization; Genetic algorithm (GA); Portfolio; Sharpe Ratio","Algorithms; Commerce; Cybernetics; Electronic trading; Finance; Financial data processing; Financial markets; Genetic algorithms; Investments; Optimization; Standardization; Assessment strategies; Calculation process; Computation complexity; Optimal portfolios; Over fitting problem; Portfolio; Portfolio optimization; Sharpe ratios; Risk assessment","Conference paper","Final","","Scopus","2-s2.0-84964509931"
"Brunato M.; Battiti R.","Brunato, Mauro (8684920500); Battiti, Roberto (6603722092)","8684920500; 6603722092","Extreme reactive portfolio (XRP): Tuning an algorithm population for global optimization","2016","Lecture Notes in Computer Science (including subseries Lecture Notes in Artificial Intelligence and Lecture Notes in Bioinformatics)","10079 LNCS","","","60","74","14","1","10.1007/978-3-319-50349-3_5","https://www.scopus.com/inward/record.uri?eid=2-s2.0-85006905983&doi=10.1007%2f978-3-319-50349-3_5&partnerID=40&md5=3d40785b08e77c3bb47aa6d860f913e3","Given the current glut of heuristic algorithms for the optimization of continuous functions, in some case characterized by complex schemes with parameters to be hand-tuned, it is an interesting research issue to assess whether competitive performance can be obtained by relying less on expert developers (whose intelligence can be a critical component of the success) and more on automated self-tuning schemes. After a preliminary investigation about the applicability of record statistics, this paper proposes a fast reactive algorithm portfolio based on simple performance indicators: record value and iterations elapsed from the last record. The two indicators are used for a combined ranking and a stochastic replacement of the worst-performing members with a new searcher with random parameters or a perturbed version of a wellperforming member. The results on benchmark functions demonstrate a performance equivalent or better than that obtained by offline tuning schemes, which require a greater amount of CPU time and cannot take care of individual structural variations between different problem instances. © Springer International Publishing AG 2016.","","Benchmarking; Global optimization; Heuristic algorithms; Stochastic systems; Benchmark functions; Competitive performance; Continuous functions; Critical component; Performance indicators; Reactive algorithms; Record statistics; Structural variations; Optimization","Conference paper","Final","","Scopus","2-s2.0-85006905983"
"Kamili H.; Riffi M.E.","Kamili, H. (56624429100); Riffi, M.E. (56111935000)","56624429100; 56111935000","Portfolio optimization using the bat algorithm","2016","International Review on Computers and Software","11","3","","277","283","6","2","10.15866/irecos.v11i3.8154","https://www.scopus.com/inward/record.uri?eid=2-s2.0-84969974932&doi=10.15866%2firecos.v11i3.8154&partnerID=40&md5=8bb45289bf188cd1eb21c49ed685b7e7","The bat algorithm is a meta-heuristic algorithm inspired by the bats behaviour characterized by using the echolocation process to localize their objective. In this work applied the bat algorithm has been used in order to solve the portfolio selection problem. This method has been adapted to the cardinality constrained efficient frontier model CCEF using four indexes Hang Seng in Hong Kong, DAX 100 in Germany FTSE 100 in USA and NIKKEI in Japan and the obtained results were compared to those of the unconstrained efficient frontier model (UEF). The bat method illustrates an optimal approximation between the constrained and the unconstrained models. © 2016 Praise Worthy Prize S.r.l. - All rights reserved.","Bat algorithm; Cardinality constrained efficient frontier model; Markowitz model; Meta-heuristic","","Article","Final","","Scopus","2-s2.0-84969974932"
"Wang Y.; Chen W.","Wang, Yun (57768389000); Chen, Wei (57212625483)","57768389000; 57212625483","A modified firefly algorithm for fuzzy portfolio optimization model","2016","Proceedings of the 28th Chinese Control and Decision Conference, CCDC 2016","","","7531711","4158","4163","5","0","10.1109/CCDC.2016.7531711","https://www.scopus.com/inward/record.uri?eid=2-s2.0-84983784181&doi=10.1109%2fCCDC.2016.7531711&partnerID=40&md5=06c7e47c2ff519d68f4be21c3e02311b","In this paper, a possibilistic portfolio selection model with transaction costs is presented, in which transaction cost is assumed as a V-Shaped function. Due to the proposed model is a non-smooth programming problem, a modified firefly algorithm (MFA) is designed. At last, a numerical example is given to illustrate our proposed effective approach. © 2016 IEEE.","Firefly algorithm; Fuzzy number; Portfolio selection; Transaction costs","","Conference paper","Final","","Scopus","2-s2.0-84983784181"
"Seyedhosseini S.M.; Esfahani M.J.; Ghaffari M.","Seyedhosseini, Seyed Mohammad (36148394400); Esfahani, Mohammad Javad (57062192500); Ghaffari, Mehdi (57062150500)","36148394400; 57062192500; 57062150500","A novel hybrid algorithm based on a harmony search and artificial bee colony for solving a portfolio optimization problem using a mean-semi variance approach","2016","Journal of Central South University","23","1","","181","188","7","61","10.1007/s11771-016-3061-9","https://www.scopus.com/inward/record.uri?eid=2-s2.0-84954519160&doi=10.1007%2fs11771-016-3061-9&partnerID=40&md5=51e351218a1cdc1c3b8d75f6e4f3f746","Portfolio selection is one of the major capital allocation and budgeting issues in financial management, and a variety of models have been presented for optimal selection. Semi-variance is usually considered as a risk factor in drawing up an efficient frontier and the optimal portfolio. Since semi-variance offers a better estimation of the actual risk portfolio, it was used as a measure to approximate the risk of investment in this work. The optimal portfolio selection is one of the non-deterministic polynomial (NP)-hard problems that have not been presented in an exact algorithm, which can solve this problem in a polynomial time. Meta-heuristic algorithms are usually used to solve such problems. A novel hybrid harmony search and artificial bee colony algorithm and its application were introduced in order to draw efficient frontier portfolios. Computational results show that this algorithm is more successful than the harmony search method and genetic algorithm. In addition, it is more accurate in finding optimal solutions at all levels of risk and return. © 2016, Central South University Press and Springer-Verlag Berlin Heidelberg.","efficient frontier; harmony search and artificial bee colony; mean semi-variance model; mean-variance model; portfolio optimizations","Algorithms; Budget control; Evolutionary algorithms; Financial data processing; Genetic algorithms; Heuristic algorithms; Polynomial approximation; Problem solving; Risk assessment; Risk perception; Artificial bee colonies; Efficient frontier; Mean variance model; Portfolio optimization; Semi-variances; Optimization","Article","Final","","Scopus","2-s2.0-84954519160"
