"Authors","Author full names","Author(s) ID","Title","Year","Source title","Volume","Issue","Art. No.","Page start","Page end","Page count","Cited by","DOI","Link","Abstract","Author Keywords","Index Keywords","Document Type","Publication Stage","Open Access","Source","EID"
"Li L.; Huang W.; Zhang Y.","Li, Lan (57196177972); Huang, Wenlan (57210977173); Zhang, Yu (57196198631)","57196177972; 57210977173; 57196198631","The mean-variance-skewness cardinality constrained portfolio optimization problem using a customized multi-objective evolutionary algorithm","2019","2019 IEEE 3rd International Conference on Electronic Information Technology and Computer Engineering, EITCE 2019","","","9094951","1938","1944","6","0","10.1109/EITCE47263.2019.9094951","https://www.scopus.com/inward/record.uri?eid=2-s2.0-85085689487&doi=10.1109%2fEITCE47263.2019.9094951&partnerID=40&md5=eda4f07df6da50e3a4cef8032f17bf89","MVSCCPO is a mean-variance-skewness portfolio optimization problem with cardinality constraint. It increases the skewness as the third objective, and introduces cardinality constraint to reduce the difficulty of asset management. A customized NSGA-III(c-NSGA-III) algorithm is proposed for the problem. It introduces an effective solution representation mechanism, customized crossover and mutation operators, a tournament selection based on membership is introduced in the mating selection phase instead of the original random selection method. Finally, an empirical analysis is carried out to verify the effectiveness of the proposed algorithm by comparing with NSGA-II and MOEA/D. The results show that c-NSGA-III performs better than other algorithms on solving MVSCCPO problem. © 2019 IEEE.","Cardinality constraint; Coding mechanism; Component multi-objective evolutionary algorithm; Fuzzy clustering; Portfolio optimization","Evolutionary algorithms; Financial data processing; Higher order statistics; Cardinality constraints; Constrained portfolios; Crossover and mutation; Effective solution; Empirical analysis; Multi objective evolutionary algorithms; Portfolio optimization; Tournament selection; Constrained optimization","Conference paper","Final","","Scopus","2-s2.0-85085689487"
"Liagkouras K.; Metaxiotis K.","Liagkouras, K. (55217590900); Metaxiotis, K. (6701910640)","55217590900; 6701910640","Improving the performance of evolutionary algorithms: a new approach utilizing information from the evolutionary process and its application to the fuzzy portfolio optimization problem","2019","Annals of Operations Research","272","1-2","","119","137","18","6","10.1007/s10479-018-2876-1","https://www.scopus.com/inward/record.uri?eid=2-s2.0-85046541947&doi=10.1007%2fs10479-018-2876-1&partnerID=40&md5=010597e33ee5f68eafdb57ee57932081","This paper examines the incorporation of useful information extracted from the evolutionary process, in order to improve algorithm performance. In order to achieve this objective, we introduce an efficient method of extracting and utilizing valuable information from the evolutionary process. Finally, this information is utilized for optimizing the search process. The proposed algorithm is compared with the NSGAII for solving some real-world instances of the fuzzy portfolio optimization problem. The proposed algorithm outperforms the NSGAII for all examined test instances. © 2018, Springer Science+Business Media, LLC, part of Springer Nature.","Evolutionary algorithms; Fuzzy systems; Information; Portfolio optimization","","Article","Final","","Scopus","2-s2.0-85046541947"
"Reddy A.A.; Vundela M.; Manju G.","Reddy, Annem Abhishek (57223619859); Vundela, Maheedhar (57223632978); Manju, G. (58397378300)","57223619859; 57223632978; 58397378300","Portfolio Optimization Using Genetic Algorithms with Nelder–Mead Algorithm","2021","Lecture Notes in Networks and Systems","177 LNNS","","","197","206","9","1","10.1007/978-981-33-4501-0_19","https://www.scopus.com/inward/record.uri?eid=2-s2.0-85105921247&doi=10.1007%2f978-981-33-4501-0_19&partnerID=40&md5=69ff9c1c857ac57c8aebc5f6a4db6ab9","Portfolio selection has a literal sense that means that the selection of an optimal portfolio which results to an asset that has minimum risk and maximized cost. The process refers to the formulation of an objective function that determines the weights of the portfolio that has to be invested in. In this paper, we have tried to optimize the selection of portfolio using genetic algorithms. Sharpe ratio has been used as a cost function to determine the fitness of stocks, and a local search algorithm, Nelder–Mead, has been used to optimize the selection of the portfolio process and to improve the efficiency. © 2021, Springer Nature Singapore Pte Ltd.","Genetic algorithm; Nelder–Mead; Portfolio optimization; Sharpe ratio; Simplex and risk-free rate","","Conference paper","Final","","Scopus","2-s2.0-85105921247"
"Liu S.; Xiao C.","Liu, Shuai (57366560300); Xiao, Chenglin (57366123800)","57366560300; 57366123800","Application and comparative study of optimization algorithms in financial investment portfolio problems","2021","Mobile Information Systems","2021","","3462715","","","","4","10.1155/2021/3462715","https://www.scopus.com/inward/record.uri?eid=2-s2.0-85120797946&doi=10.1155%2f2021%2f3462715&partnerID=40&md5=d48f7f5083cb01cd84e1f420f7ebf540","Portfolio theory mainly studies how to optimize the allocation of assets under the premise of maximizing expected returns and minimizing investment risks. In view of the instability of the financial market, a diversified investment portfolio can help control the loss of the investment portfolio. In addition to paying attention to the safety and return of asset allocation, we cannot ignore the liquidity of assets, that is, their liquidity. Adding high-liquidity products to asset allocation, such as equity investment, can better control the financial cash flow in response to emergencies. One of the ways to make assets flow is to securitize assets and sell them to the market. In order to revitalize the stock assets, good investment efficiency is a necessary choice for financial investment. Various financial products and their derivatives continue to enter people's vision. There are many financial products in reality, and optimizing the investment portfolio can bring high economic benefits. The purpose of this paper is to study the application of optimization algorithms in financial portfolio problems. (1) Monetary policy remains prudent and neutral. It is not easy to expect flooding, but flexibility is required in complex situations. (2) Financial resources are tilted towards innovation and transformation and capital markets, which is beneficial to the development of capital markets in the medium and long term. (3) Unblocking the transmission mechanism is conducive to lenient credit and tapping the wrong killing opportunities in private enterprise debt. (4) Banks and other financial institutions have moderate pressure to give benefits to entities, but in the long run, the interests of the two are consistent. (5) Finance risk prevention will continue, orderly breaking the rigid exchange and reshaping the financial structure and ecology. (6) The pace of opening up of the financial industry has accelerated, and the bond market investor structure has improved. In this paper, we establish different optimization schemes to compare and study the portfolio problem and then use MATLAB to solve the modeling and programming problem, calculate the highest return rate and the lowest risk value before and after optimization, and then make a comparative analysis to get a better optimization scheme. The results show that the genetic algorithm model is superior to the quadratic programming method in terms of risk control. The minimum risk of portfolio optimization through genetic algorithm has been reduced by about 40%, and the maximum return has increased by about 25%. The comprehensive optimization effect is better than the quadratic planning method and ultimately can obtain higher economic benefits. It can be seen that the optimization algorithm is of great significance for the comparative study of financial portfolio problems.  © 2021 Shuai Liu and Chenglin Xiao.","","Commerce; Economic and social effects; Electronic trading; Financial markets; Genetic algorithms; MATLAB; Quadratic programming; Risk assessment; Application studies; Asset allocation; Comparatives studies; Economic benefits; Financial investments; Financial portfolio; Financial products; Investments portfolios; Optimization algorithms; Optimization scheme; Investments","Article","Final","All Open Access; Gold Open Access","Scopus","2-s2.0-85120797946"
"Rajabi M.; Khaloozadeh H.","Rajabi, Mahsa (57265391000); Khaloozadeh, Hamid (16642417400)","57265391000; 16642417400","Investigation and Comparison of the Performance of Multi-Objective Evolutionary Algorithms Based on Decomposition and Dominance in Portfolio Optimization","2018","26th Iranian Conference on Electrical Engineering, ICEE 2018","","","8472663","923","929","6","2","10.1109/ICEE.2018.8472663","https://www.scopus.com/inward/record.uri?eid=2-s2.0-85055622776&doi=10.1109%2fICEE.2018.8472663&partnerID=40&md5=b7e761e31683cb1fa53aaeab4b89c548","A new approach in multi-objective evolutionary optimization is decomposition. Decomposition is a basic method in old multi-objective optimization which in evolutionary multiobjective optimization, has not been widely used. Using this method, a multi-objective optimization problem is converted into a number of scalar subproblems, and all the subproblems are simultaneously optimized. In this paper, the performance and efficiency of the algorithm MOEA/D (multi-objective evolutionary algorithm based on decomposition) with the performance of two algorithms NSGA-II and MOPSO (evolution optimization methods based on dominance) for solving constrained portfolio optimization in Tehran Stock Exchange, has been compared. Portfolio return and its risk, has been considered as the optimization objectives and CvaR has been considered as a risk measure. The results indicate the high potential of these algorithms for constrained portfolio optimization. Also, the results indicate that the optimization algorithm based on decomposition has lower computational complexity, and Pareto front is more extensive than the other two methods. (Abstract) © 2018 IEEE.",")","Constrained optimization; Electronic trading; Multiobjective optimization; Risk assessment; Constrained portfolios; Evolutionary multiobjective optimization; Multi objective evolutionary algorithms; Multi-objective evolutionary optimizations; Multi-objective optimization problem; Optimization algorithms; Portfolio optimization; Tehran stock exchanges; Evolutionary algorithms","Conference paper","Final","","Scopus","2-s2.0-85055622776"
"Kalayci C.B.; Polat O.; Akbay M.A.","Kalayci, Can B. (54951330900); Polat, Olcay (54411047300); Akbay, Mehmet A. (57205753430)","54951330900; 54411047300; 57205753430","An efficient hybrid metaheuristic algorithm for cardinality constrained portfolio optimization","2020","Swarm and Evolutionary Computation","54","","100662","","","","35","10.1016/j.swevo.2020.100662","https://www.scopus.com/inward/record.uri?eid=2-s2.0-85079283313&doi=10.1016%2fj.swevo.2020.100662&partnerID=40&md5=a8fe3fa18c51d7dda5640fd477e25153","Portfolio optimization with cardinality constraints turns out to be a mixed-integer quadratic programming problem which is proven to be NP-Complete that limits the efficiency of exact solution approaches, often because of the long-running times. Therefore, particular attention has been given to approximate approaches such as metaheuristics which do not guarantee optimality, yet may expeditiously provide near-optimal solutions. The purpose of this study is to present an efficient hybrid metaheuristic algorithm that combines critical components from continuous ant colony optimization, artificial bee colony optimization and genetic algorithms for solving cardinality constrained portfolio optimization problem. Computational results on seven publicly available benchmark problems confirm the effectiveness of the hybrid integration mechanism. Moreover, comparisons against other methods’ results in the literature reveal that the proposed solution approach is competitive with state-of-the-art algorithms. © 2020 Elsevier B.V.","Artificial bee colony; Cardinality constraints; Continuous ant colony optimization; Genetic algorithms; Metaheuristics; Portfolio optimization","Ant colony optimization; Artificial intelligence; Financial data processing; Genetic algorithms; Heuristic algorithms; Integer programming; Quadratic programming; Artificial bee colonies; Artificial bee colony optimizations; Cardinality constraints; Hybrid metaheuristic algorithms; Meta heuristics; Mixed integer quadratic programming; Portfolio optimization; State-of-the-art algorithms; Constrained optimization","Article","Final","","Scopus","2-s2.0-85079283313"
"Chen W.; Xu W.","Chen, Wei (57212625483); Xu, Wen (57208062171)","57212625483; 57208062171","A Hybrid Multiobjective Bat Algorithm for Fuzzy Portfolio Optimization with Real-World Constraints","2019","International Journal of Fuzzy Systems","21","1","","291","307","16","35","10.1007/s40815-018-0533-0","https://www.scopus.com/inward/record.uri?eid=2-s2.0-85063673828&doi=10.1007%2fs40815-018-0533-0&partnerID=40&md5=bc4451f89c98a742fae2111088ec5e55","This paper investigates a fuzzy portfolio selection problem in the framework of multiobjective optimization. A multiobjective mean–semivariance–entropy model with fuzzy returns is proposed for portfolio selection. Specifically, it simultaneously optimizes the return, risk and portfolio diversification, taking into account transaction costs, liquidity, buy-in thresholds, and cardinality constraints. Since this kind of mixed-integer nonlinear programming problems cannot be efficiently solved by the conventional optimization approaches, a new metaheuristic method termed as the hybrid BA–DE is developed by combining features of the bat algorithm (BA) and differential evolution (DE). In order to demonstrate the effectiveness of the proposed approaches, we also provide a numerical example. © 2018, Taiwan Fuzzy Systems Association and Springer-Verlag GmbH Germany, part of Springer Nature.","Bat algorithm; Differential evolution; Fuzzy variables; Multiobjective optimization; Portfolio selection","Evolutionary algorithms; Financial data processing; Integer programming; Nonlinear programming; Bat algorithms; Differential Evolution; Fuzzy portfolio optimizations; Fuzzy variable; Multi objective; Multi-objectives optimization; Portfolio selection; Portfolio selection problems; Real world constraints; Semi-variances; Multiobjective optimization","Article","Final","","Scopus","2-s2.0-85063673828"
"Chen C.-H.; Ye C.-Y.; Lee Y.-C.; Hong T.-P.","Chen, Chun-Hao (57211067310); Ye, Chong-You (57223099692); Lee, Yeong-Chyi (8338911000); Hong, Tzung-Pei (7202830492)","57211067310; 57223099692; 8338911000; 7202830492","A SPEA-Based Group Trading Strategy Portfolio Optimization Algorithm","2021","Lecture Notes in Computer Science (including subseries Lecture Notes in Artificial Intelligence and Lecture Notes in Bioinformatics)","12672 LNAI","","","583","592","9","0","10.1007/978-3-030-73280-6_46","https://www.scopus.com/inward/record.uri?eid=2-s2.0-85104806428&doi=10.1007%2f978-3-030-73280-6_46&partnerID=40&md5=30464004cc13c2e86abe4836077998cc","Trading strategies are usually employed for finding trading signals for increasing returns as well as reducing risks. As a result, many approaches have been proposed for obtaining trading strategy portfolio. The group trading strategy portfolio (GTSP) optimization approaches that can be used to provide various trading strategy portfolios were also proposed. Because different criteria should be considered to derive GTSPs, a MOGA (multi-objective genetic algorithm) based approach has been presented for searching non-dominated solutions. In this paper, to extract a better set of non-dominated solutions, we propose a SPEA-based algorithm for deriving GTSPs with two objective functions. Since the goal of trading is to get profit, the first objective function is utilized to evaluate the return and risk of a candidate GTSP. The second objective function is used to evaluate whether the numbers of strategies between groups are similar and weights of groups as well. Experiments were conducted on a financial dataset to show the effectiveness of the proposed approach and comparison results of the proposed approach and the previous approach. © 2021, Springer Nature Switzerland AG.","Group trading strategy portfolio; Grouping genetic algorithm; Multi-objective optimization algorithms; Multi-objective problem; Trading strategy","Commerce; Database systems; Function evaluation; Genetic algorithms; Comparison result; Multi-objective genetic algorithm; Nondominated solutions; Objective functions; Optimization approach; Portfolio optimization; Trading strategies; Electronic trading","Conference paper","Final","","Scopus","2-s2.0-85104806428"
"Erica E.; Handari B.D.; Hertono G.F.","Erica, E. (57204548266); Handari, B.D. (57195203524); Hertono, G.F. (56719678200)","57204548266; 57195203524; 56719678200","Agglomerative clustering and genetic algorithm in portfolio optimization","2018","AIP Conference Proceedings","2023","","020217","","","","3","10.1063/1.5064214","https://www.scopus.com/inward/record.uri?eid=2-s2.0-85056145839&doi=10.1063%2f1.5064214&partnerID=40&md5=6b16427c641f7fd37cb78a00b9a0e14d","Creating and managing a successful stock portfolio are a difficult and challenging practice caused by the uncertainty created by the fluctuation of the stocks and the randomness in the market itself. Portfolio diversification, as stated in modern portfolio theory, is a go-to solution to manage risks. The purpose of portfolio diversification is to reduce the return's variance compared with a single stock investment or undiversified portfolio. The primary motivation of this research is to investigate the portfolio selection strategies through clustering and application of genetic algorithm. Cluster analysis serves as a method to cluster assets with similar financial ratio scores which is the scores of Earnings/Share (EPS), Price/Earnings Ratio (PER), Price/Earnings to Growth (PEG), Return on Asset (ROA), Return on Equity (ROE), and Debt to Equity Ratio (DER). By clustering method, homogeneous clusters are produced and can be used in diversifying portfolio. In this paper, Agglomerative Clustering (AC) is used as the clustering method. Then Genetic Algorithm (GA) will be applied to each resulting cluster to obtain the optimal proportion of each stock in the portfolio. Genetic algorithm is a searching algorithm based on genetic principles and natural selection. The performance of Genetic Algorithm combined with Agglomerative Clustering (ACGA) in portfolio optimization, evaluated based on some actual datasets, gives a portfolio with bigger expected return than a portfolio constructed with only Genetic Algorithm or a portfolio constructed by uniformly weighted stock. © 2018 Author(s).","Agglomerative Clustering; Genetic Algorithm; Portfolio Optimization; Portfolio Selection","","Conference paper","Final","All Open Access; Bronze Open Access","Scopus","2-s2.0-85056145839"
"Kolomeytsev Y.","Kolomeytsev, Yury (57388133100)","57388133100","Meta Algorithms for Portfolio Optimization Using Reinforcement Learning","2021","Communications in Computer and Information Science","1514 CCIS","","","154","168","14","0","10.1007/978-3-030-92711-0_11","https://www.scopus.com/inward/record.uri?eid=2-s2.0-85121860232&doi=10.1007%2f978-3-030-92711-0_11&partnerID=40&md5=a2ffab8969a659b47ca243f9706398a1","We explore the effectiveness of various machine learning algorithms, especially deep reinforcement learning, for solving the portfolio optimization problem. The investigated algorithms can be divided into the following groups: “Follow-the-Winner” (using trend follow principle), “Follow-the-Loser” (using mean reversion principle) “Pattern-Matching” (for example, using correlations between current prices and historical prices), “Meta-Learning Algorithms” (combination of several algorithms) and, finally, strategies based on reinforcement learning. We propose a novel meta-learning algorithm based on deep reinforcement learning, which we call MetaRL. It utilizes algorithms from different groups and optimizes their combination. Reinforcement learning (RL) technique is well suited to solve portfolio selection tasks because it can learn hidden dependencies in financial data and trading patterns by trial and error, directly predicts trading actions, and allows to consider delayed rewards. Moreover, RL naturally takes into account transaction costs and can model real trading when the strategy can impact the market. As agents, we use deep neural networks that decide which of the algorithms will be more profitable at a particular moment. We provide extensive experiments using financial data and show that our new MetaRL algorithm substantially outperforms other portfolio optimization methods. © 2021, Springer Nature Switzerland AG.","Deep learning; Meta learning; Portfolio optimization; Quantitative finance; Reinforcement learning","Commerce; Costs; Deep neural networks; Electronic trading; Financial markets; Learning algorithms; Pattern matching; Deep learning; Financial data; Machine learning algorithms; Mean-reversion; Meta-algorithms; Metalearning; Optimization problems; Portfolio optimization; Quantitative finance; Reinforcement learnings; Reinforcement learning","Conference paper","Final","","Scopus","2-s2.0-85121860232"
"Sun Y.; Ren H.","Sun, Yingjia (57219259587); Ren, Hongfeng (57223023562)","57219259587; 57223023562","A GD-PSO algorithm for smart transportation supply chain ABS portfolio optimization","2021","Discrete Dynamics in Nature and Society","2021","","6653051","","","","3","10.1155/2021/6653051","https://www.scopus.com/inward/record.uri?eid=2-s2.0-85104526770&doi=10.1155%2f2021%2f6653051&partnerID=40&md5=a6acf0a0be38d97c0e60953ab10b9f85","Financial technology and smart transportation is key cross-field of transportation in the future. The demand for smart transportation investment is constantly released. As typical and efficient financial products, asset-backed securities (ABS) can greatly improve the turnover efficiency of funds between upstream suppliers and downstream buyers in the field of smart transportation and also help participants of the supply chain to maintain healthier financial situations. However, one of the most common problems of ABS is portfolio allocation, which needs portfolio optimization based on massive assets with multiple objectives and constraints. Especially, in the field of smart transportation, sources of underlying assets can always be complex, which may involve a variety of subdivision industries and regions. At the same time, due to the relationships between upstream and downstream entities in the supply chain, correlations among assets can be strong. So, during the optimization of smart transportation ABS portfolio allocation, it is necessary to identify and deal with those problems. Different from forward selection or linear optimization, which could have low efficiency for complicated problems with large sample size and multiple objectives, new methods and algorithms for NP-hard problems would be necessary to be investigated. In this article, a penalty function based on graph density (GD) was introduced to the particle swarm optimization algorithm (PSO), and a GD-PSO algorithm was proposed. Experiments also showed that the GD-PSO algorithm solved the problem of portfolio optimization in smart transportation supply chain ABS effectively.  Copyright © 2021 Yingjia Sun and Hongfeng Ren.","","","Article","Final","All Open Access; Gold Open Access","Scopus","2-s2.0-85104526770"
