"Authors","Author full names","Author(s) ID","Title","Year","Source title","Volume","Issue","Art. No.","Page start","Page end","Page count","Cited by","DOI","Link","Abstract","Author Keywords","Index Keywords","Document Type","Publication Stage","Open Access","Source","EID"
"Vasant P.","Vasant, Pandian (8948616300)","8948616300","Meta-heuristics optimization algorithms in engineering, business, economics, and finance","2012","Meta-Heuristics Optimization Algorithms in Engineering, Business, Economics, and Finance","","","","1","708","707","68","10.4018/978-1-4666-2086-5","https://www.scopus.com/inward/record.uri?eid=2-s2.0-84900646342&doi=10.4018%2f978-1-4666-2086-5&partnerID=40&md5=508f6e45f669124f3bb410d495031277","Optimization techniques have developed into a significant area concerning industrial, economics, business, and financial systems. With the development of engineering and financial systems, modern optimization has played an important role in service-centered operations and as such has attracted more attention to this field. Meta-heuristic hybrid optimization is a newly development mathematical framework based optimization technique. Designed by logicians, engineers, analysts, and many more, this technique aims to study the complexity of algorithms and problems. Meta-Heuristics Optimization Algorithms in Engineering, Business, Economics, and Finance explores the emerging study of meta-heuristics optimization algorithms and methods and their role in innovated real world practical applications. This book is a collection of research on the areas of meta-heuristics optimization algorithms in engineering, business, economics, and finance and aims to be a comprehensive reference for decision makers, managers, engineers, researchers, scientists, financiers, and economists as well as industrialists. © 2013 by IGI Global. All rights reserved.","","","Book","Final","","Scopus","2-s2.0-84900646342"
"Samuel Baixauli-Soler J.; Alfaro-Cid E.; Fernandez-Blanco M.O.","Samuel Baixauli-Soler, J. (35271056700); Alfaro-Cid, Eva (17433406200); Fernandez-Blanco, Matilde O. (35271650700)","35271056700; 17433406200; 35271650700","A naïve approach to speed up portfolio optimization problem using a multiobjective genetic algorithm","2012","Investigaciones Europeas de Direccion y Economia de la Empresa","18","2","","126","131","5","3","10.1016/S1135-2523(12)70002-3","https://www.scopus.com/inward/record.uri?eid=2-s2.0-84864311247&doi=10.1016%2fS1135-2523%2812%2970002-3&partnerID=40&md5=00e73f8b8a9d1eb3a7e0a4c9dfb64ae2","Genetic algorithms (GAs) are appropriate when investors have the objective of obtaining mean-variance (VaR) efficient frontier as minimising VaR leads to non-convex and non-differential risk-return optimisation problems. However GAs are a time-consuming optimisation technique. In this paper, we propose to use a naïve approach consisting of using samples split by quartile of risk to obtain complete efficient frontiers in a reasonable computation time. Our results show that using reduced problems which only consider a quartile of the assets allow us to explore the efficient frontier for a large range of risk values. In particular, the third quartile allows us to obtain efficient frontiers from the 1.8% to 2.5% level of VaR quickly, while that of the first quartile of assets is from 1% to 1.3% level of VaR. © 2012 AEDEM.","Efficient portfolio; Genetic algorithm; Value-at-Risk","","Article","Final","All Open Access; Gold Open Access; Green Open Access","Scopus","2-s2.0-84864311247"
"Kremmel T.; Kubalík J.; Biffl S.","Kremmel, Thomas (36131531300); Kubalík, Jiří (6507548456); Biffl, Stefan (6701704981)","36131531300; 6507548456; 6701704981","Multiobjective evolutionary algorithm for software project portfolio optimization","2010","Proceedings of the 12th Annual Genetic and Evolutionary Computation Conference, GECCO '10","","","","1389","1390","1","5","10.1145/1830483.1830738","https://www.scopus.com/inward/record.uri?eid=2-s2.0-77955900062&doi=10.1145%2f1830483.1830738&partnerID=40&md5=b250962907f27ea4082db694ee1ebd96","Large software companies have to plan their project portfolio to maximize potential portfolio return and strategic alignment, while balancing various preferences, and considering limited resources. However, software project portfolios are challenging to describe for optimization in a practical way that allows efficient optimization. In this paper we propose an approach to describe software project portfolios with a set of multiobjective criteria for portfolio managers using the COCOMO II model and introduce a multiobjective evolutionary approach, mPOEMS, to find the Pareto-optimal front efficiently. The proposed approach was evaluated on a set of 50 projects that follow the validated COCOMO II model criteria. Major results are: the proposed project portfolio management approach was found usable and useful; the mPOEMS algorithm shows capabilities for efficiently solving the combinatorial optimization problem of this type.","Evolutionary algorithms; Multiobjective optimization; Project portfolio management","Combinatorial optimization; Evolutionary algorithms; Financial data processing; Investments; COCOMO II; Combinatorial optimization problems; Evolutionary approach; Multi objective; Multi objective evolutionary algorithms; Pareto-optimal front; Portfolio managers; Project portfolio; Project portfolio management; Software company; Software project; Strategic alignment; Multiobjective optimization","Conference paper","Final","","Scopus","2-s2.0-77955900062"
"Hajnoori A.; Amiri M.; Alimi A.","Hajnoori, A. (56175349500); Amiri, M. (26038890600); Alimi, A. (7003687617)","56175349500; 26038890600; 7003687617","Forecasting stock price using grey-fuzzy technique and portfolio optimization by invasive weed optimization algorithm","2013","Decision Science Letters","2","3","","175","184","9","16","10.5267/j.dsl.2013.04.004","https://www.scopus.com/inward/record.uri?eid=2-s2.0-84901235072&doi=10.5267%2fj.dsl.2013.04.004&partnerID=40&md5=baeab8738cfb0e113b006abf6c8d259d","Portfolio optimization problem follows the calculation of investment income per share, based on return and risk criteria. Since stock risk is achieved by calculating its return, which is itself computed based on stock price, it is essential to forecast the stock price, efficiently. In this paper, in order to predict the stock price, grey fuzzy technique with high efficiency is employed. The proposed study of this paper calculates the return and risk of each asset and portfolio optimization model is developed based on cardinality constraint and investment income per share. To solve the resulted model, Invasive Weed Optimization (IWO) algorithm is applied. In an example this algorithm is compared with other metaheuristic algorithms such as Imperialist Competitive Algorithm (ICA), Genetic Algorithm (GA) and Particle Swarm Optimization (PSO). The results show that the applied algorithm performs significantly better than other algorithms. © 2013 Growing Science Ltd. All rights reserved.","Cardinality constraint; Grey fuzzy technique; Invasive weed algorithm; Portfolio optimization model; Prediction","","Article","Final","All Open Access; Gold Open Access","Scopus","2-s2.0-84901235072"
"Chang J.-F.","Chang, Jui-Fang (16030414000)","16030414000","A performance comparison between genetic algorithms and particle swarm optimization applied in constructing equity portfolios","2009","International Journal of Innovative Computing, Information and Control","5","12","","5069","5079","10","31","","https://www.scopus.com/inward/record.uri?eid=2-s2.0-74349131464&partnerID=40&md5=f5c1a901aa659c3478fb4d1e4ca3361f","This research compares Genetic Algorithms (GA) and the Particle Swarm Optimization (PS0) as efficient sourcing solutions for constructing optimal equity portfolios. The h value with Sharpe ratio (HVSR) and Sharpe index are separately adopted to choose stocks. The PS0 and GA are applied to these stocks in search for the optimal capital allocation for constructing equity portfolios. Comparing with the results of annual return in all periods, our researrh model(HVSR) is better than Sharpe ratio. The research also compares the returns of the Equity Portfolios with that of Taiwan Weighted Stock Index (TWSI,) and that of the best return of equity fund (the Best Equity Fund). The results show that the portfolio performance constructed by PS0 is better than that of GA. In fact, the performance is superior to that of the existing best stock fund rate of return in Taiwan Funds Market and TWSI. © 2009 ISSN.","Equity portfolio; Genetic algorithms; Particle swarm optimization; Performance evaluation","Earnings; Genetic algorithms; Annual returns; Capital allocation; Equity funds; Equity portfolio; Performance comparison; Performance evaluation; Rate of return; Stock indices; Particle swarm optimization (PSO)","Conference paper","Final","","Scopus","2-s2.0-74349131464"
"Resta M.","Resta, Marina (56225368400)","56225368400","Portfolio optimization with dimension reduction techniques: A comprehensive simulation study","2012","Neurocomputing: Learning, Architectures and Modeling","","","","93","118","25","0","","https://www.scopus.com/inward/record.uri?eid=2-s2.0-84895282255&partnerID=40&md5=d6eb5091caf0809e0d1c1c835000a679","This work is aimed to provide a comprehensive simulation study on dimension reduction techniques that support the decision process underlying the management of financia portfolios. We will test whether it is possible to built allocation schemes in different ways other than picking up assets according to classical mean-variance criteria. To such aim, we will examine various dimension reduction techniques and merge them into a framework that selects the most promising assets according to their proximity to the centroids of each procedure. Extensive simulations are provided, where we will analyze the performance of the examined techniques, and compare them to those of traditional allocation schemes. © 2012 by Nova Science Publishers, Inc. All rights reserved.","Dimensions reduction; Portfolio optimization","","Book chapter","Final","","Scopus","2-s2.0-84895282255"
"Chen Y.; Zhu H.","Chen, Yun (55721092700); Zhu, Hanhong (36165246900)","55721092700; 36165246900","PSO heuristics algorithm for portfolio optimization","2010","Lecture Notes in Computer Science (including subseries Lecture Notes in Artificial Intelligence and Lecture Notes in Bioinformatics)","6145 LNCS","PART 1","","183","190","7","3","10.1007/978-3-642-13495-1_23","https://www.scopus.com/inward/record.uri?eid=2-s2.0-77954651535&doi=10.1007%2f978-3-642-13495-1_23&partnerID=40&md5=40ff198e616e6c819d70c9a12c3de245","One of the most studied problems in the financial is the intractability of the portfolios. Some practical formulations of the problem include various kinds of nonlinear constraints and objectives and can be efficiently solved by approximate algorithms. In this paper, we present a meta-heuristic algorithm named Particle Swarm Optimization (PSO) to the construction of optimal risky portfolios for financial investments. The PSO algorithm is tested on two portfolio optimization models and a comparative study with Genetic Algorithm has been implemented. The PSO model demonstrates high computational efficiency in constructing optimal risky portfolios. Preliminary results show that the approach is very promising and achieves results comparable or superior with the state of the art solvers. © 2010 Springer-Verlag.","Efficient Frontier (EF); Particle Swarm Optimization (PSO); Portfolio Management (PM); Sharp Ratio (SR); Swarm Intelligence (SI)","Cellular automata; Computational efficiency; Financial data processing; Heuristic algorithms; Investments; Approximate algorithms; Comparative studies; Efficient frontier; Efficient Frontier (EF); Financial investments; Heuristics algorithm; Meta heuristic algorithm; Non-linear constraints; Portfolio managements; Portfolio optimization; Portfolio optimization models; PSO algorithms; State of the art; Swarm intelligence; Particle swarm optimization (PSO)","Conference paper","Final","","Scopus","2-s2.0-77954651535"
"Giannakouris G.; Vassiliadis V.; Dounias G.","Giannakouris, Giorgos (36696324700); Vassiliadis, Vassilios (7004115264); Dounias, George (6603714446)","36696324700; 7004115264; 6603714446","Experimental study on a hybrid nature-inspired algorithm for financial portfolio optimization","2010","Lecture Notes in Computer Science (including subseries Lecture Notes in Artificial Intelligence and Lecture Notes in Bioinformatics)","6040 LNAI","","","101","111","10","29","10.1007/978-3-642-12842-4_14","https://www.scopus.com/inward/record.uri?eid=2-s2.0-78650500154&doi=10.1007%2f978-3-642-12842-4_14&partnerID=40&md5=e76572d23e75531d19eac268c954b1ee","Hybrid intelligent schemes have proven their efficiency in solving NP-hard optimization problems. Portfolio optimization refers to the problem of finding the optimal combination of assets and their corresponding weights which satisfies a specific investment goal and various constraints. In this study, a hybrid intelligent metaheuristic, which combines the Ant Colony Optimization algorithm and the Firefly algorithm, is proposed in tackling a complex formulation of the portfolio management problem. The objective function under consideration is the maximization of a financial ratio which combines factors of risk and return. At the same time, a hard constraint, which refers to the tracking ability of the constructed portfolio towards a benchmark stock index, is imposed. The aim of this computational study is twofold. Firstly, the efficiency of the hybrid scheme is highlighted. Secondly, comparison results between alternative mechanisms, which are incorporated in the main function of the hybrid scheme, are presented. © Springer-Verlag Berlin Heidelberg 2010.","Ant colony optimization algorithm; Firefly algorithm; Hybrid NII algorithm; Portfolio optimization","Artificial intelligence; Bioluminescence; Financial data processing; Investments; Nickel compounds; Optimization; Ant Colony Optimization algorithms; Comparison result; Complex formulations; Computational studies; Corresponding weights; Experimental studies; Financial portfolio; Financial ratios; Firefly algorithm; Hard constraints; Hybrid NII algorithm; Hybrid scheme; Intelligent schemes; Metaheuristic; Nature-inspired algorithms; NP-hard; Objective functions; Optimal combination; Optimization problems; Portfolio managements; Portfolio optimization; Specific investment; Stock indices; Tracking ability; Algorithms","Conference paper","Final","","Scopus","2-s2.0-78650500154"
"Wang Z.; Liu S.; Kong X.","Wang, Zhen (56323971400); Liu, Sanyang (7409457898); Kong, Xiangyu (55144112900)","56323971400; 7409457898; 55144112900","An improved artificial bee colony algorithm for portfolio optimization Problem","2011","International Journal of Advancements in Computing Technology","3","10","","67","74","7","10","10.4156/ijact.vol3.issue10.9","https://www.scopus.com/inward/record.uri?eid=2-s2.0-82755192252&doi=10.4156%2fijact.vol3.issue10.9&partnerID=40&md5=0928fc86d556a91e3d757e77f0d186ed","To tackle the cardinality constrained portfolio optimization problem, an improved artificial bee colony algorithm is designed. The Deb's selection rule is introduced to guarantee the feasibility of optimal solution. To improve the convergent speed, a new search strategy is proposed. Furthermore, the Bolzmann selection probability is employed to maintain the population diversity. The experiment results indicate that the proposed algorithm is efficient and effective for the portfolio optimization problem, which can obtain a better portfolio strategy and diversify the portfolio risk efficiently.","Artificial bee colony; Efficient frontier; Portfolio optimization","Constrained optimization; Financial data processing; Artificial bee colonies; Cardinalities; Constrained portfolios; Convergent speed; Efficient frontier; Optimal solutions; Population diversity; Portfolio optimization; Portfolio strategies; Search strategies; Selection probabilities; Selection Rules; Evolutionary algorithms","Article","Final","","Scopus","2-s2.0-82755192252"
"Corazza M.; Fasano G.; Gusso R.","Corazza, Marco (55108761600); Fasano, Giovanni (6603941987); Gusso, Riccardo (55875764600)","55108761600; 6603941987; 55875764600","Portfolio selection with an alternative measure of risk: Computational performances of Particle Swarm Optimization and Genetic Algorithms","2012","Mathematical and Statistical Methods for Actuarial Sciences and Finance","","","","123","130","7","9","10.1007/978-88-470-2342-0_15","https://www.scopus.com/inward/record.uri?eid=2-s2.0-84900157977&doi=10.1007%2f978-88-470-2342-0_15&partnerID=40&md5=3490298e816cd2e9e38fc04a2c5689e7","In the classical model for portfolio selection the risk is measured by the variance of returns. Recently several alternative measures of risk have been proposed. In this contribution we focus on a class of measures that uses information contained both in lower and in upper tail of the distribution of the returns. We consider a nonlinear mixed-integer portfolio selection model which takes into account several constraints used in fund management practice. The latter problem is NP-hard in general, and exact algorithms for its minimization, which are both effective and efficient, are still sought at present. Thus, to approximately solve this model we experience the heuristics Particle Swarm Optimization (PSO) and we compare the performances of this methodology with respect to another well-known heuristic technique for optimization problems, that is Genetic Algorithms (GA). © Springer-Verlag Italia 2012.","Constrained optimization; Evolutionary optimization; Genetic Algorithms; Measures of risk; Particle Swarm Optimization; Portfolio selection problem","Constrained optimization; Heuristic methods; Particle swarm optimization (PSO); Risk assessment; Statistical methods; Computational performance; Evolutionary optimizations; Exact algorithms; Heuristic techniques; Optimization problems; Portfolio selection; Portfolio selection models; Portfolio selection problems; Genetic algorithms","Conference paper","Final","","Scopus","2-s2.0-84900157977"
"Cao J.; Tao L.","Cao, Jianguo (36454501400); Tao, Liang (7201566937)","36454501400; 7201566937","Improved particle swarm algorithm for portfolio optimization problem","2010","ICIMA 2010 - 2010 2nd International Conference on Industrial Mechatronics and Automation","2","","5538246","561","564","3","5","10.1109/ICINDMA.2010.5538246","https://www.scopus.com/inward/record.uri?eid=2-s2.0-77956201204&doi=10.1109%2fICINDMA.2010.5538246&partnerID=40&md5=5049ef7ab109d73dd9f616524101b1e2","Particle swarm optimization (PSO) is a recently proposed population-based random search algorithm, which performs well in some optimization problems. In this paper, we proposed an improved PSO algorithm to solve portfolio selection problems. The proposed approach IPSO employs an opposite mutation operator to enhance the performance of the standard PSO. In order to verify the performance of IPSO, we test it on five well-known benchmark function optimization problems. At last, we use IPSO to solve a classical portfolio selection problem. The results show that the proposed approach is effective and achieves better results than standard PSO. ©2010 IEEE.","Optimization; Particle swarm optimization (PSO); Portfolio selection","Algorithms; Financial data processing; Mathematical operators; Mechatronics; Benchmark functions; Improved PSO; Mutation operators; Optimization problems; Particle swarm algorithm; Portfolio optimization; Portfolio selection; Portfolio selection problems; Random search algorithm; Standard PSO; Particle swarm optimization (PSO)","Conference paper","Final","","Scopus","2-s2.0-77956201204"
"Huang Y.; Tian C.; Fang W.","Huang, Yuansheng (37066099300); Tian, Chengfang (35079480400); Fang, Wei (57199951671)","37066099300; 35079480400; 57199951671","Research on real estate portfolio optimization model based on improved niche genetic algorithm","2009","Proceedings - 2009 International Symposium on Information Engineering and Electronic Commerce, IEEC 2009","","","5175141","375","378","3","0","10.1109/IEEC.2009.84","https://www.scopus.com/inward/record.uri?eid=2-s2.0-71049147979&doi=10.1109%2fIEEC.2009.84&partnerID=40&md5=a576d6b7c97ce64317796b6d750691cf","The investment on real estate companies has a direct impact on the competitiveness of their future markets; therefore there is an urgent need for investment portfolio optimization. The paper analyzes the characteristics of various types of real estate investment in the next run, using niche genetic algorithm with improved the probability of crossover and mutation. In addition, adding the budget constraints in the classic portfolio model, so that the process of calculating is more to meet realistic requirements. Finally, an example is used to prove the method is effective. © 2009 IEEE.","Multipleobject optimization; Niche genetic algorithm (NGA); Portfolio","Competition; Ecology; Electronic commerce; Financial data processing; Genetic algorithms; Optimization; Probabilistic logics; Budget constraint; Crossover and mutation; Direct impact; Improved niche genetic algorithms; Investment portfolio; Multipleobject optimization; Niche genetic algorithm; Niche genetic algorithm (NGA); Portfolio; Portfolio model; Portfolio optimization models; Real estate; Real estate investment; Investments","Conference paper","Final","","Scopus","2-s2.0-71049147979"
"George E.D.; Farid S.S.","George, Edmund D. (24738876600); Farid, Suzanne S. (7005343335)","24738876600; 7005343335","Combinatorial Optimisation Algorithms for Strategic Biopharmaceutical Portfolio & Capacity Management","2009","Computer Aided Chemical Engineering","26","","","1063","1068","5","1","10.1016/S1570-7946(09)70177-4","https://www.scopus.com/inward/record.uri?eid=2-s2.0-67649112307&doi=10.1016%2fS1570-7946%2809%2970177-4&partnerID=40&md5=f837b32d49f8f1e9919c36e2e0f7462b","The development of a stochastic combinatorial multi-objective optimisation framework is presented which addresses the challenge of exploring large decision spaces while also capturing the multitude of decisions, trade-offs and uncertainties involved in R&D portfolio management. Detailed process economic models were linked to models of the drug development pathway to predict the technical, financial and risk implications of alternative strategies for portfolios of biopharmaceutical drugs proceeding through development. Machine learning and evolutionary computation techniques were harnessed to evolve strategies to multi-objective optimality. An industrially-relevant case study is presented that focuses on the following decisions for a portfolio of therapeutic antibodies: the portfolio composition, the scheduling of critical development and manufacturing activities, and the involvement of third parties for these activities. The impact of budgetary constraints on the optimal set of solutions is also illustrated. © 2009 Elsevier B.V. All rights reserved.","biopharmaceutical drug development; capacity planning; multi-objective; portfolio management; stochastic combinatorial optimisation","","Article","Final","","Scopus","2-s2.0-67649112307"
"Mercurio A.; Di Giorgio A.; Pimpinella L.","Mercurio, Andrea (27867837100); Di Giorgio, Alessandro (24723969100); Pimpinella, Laura (36024499300)","27867837100; 24723969100; 36024499300","Generation Portfolio Optimization by NPV formulation, Monte Carlo Estimators and Genetic Algorithms","2010","18th Mediterranean Conference on Control and Automation, MED'10 - Conference Proceedings","","","5547777","761","766","5","1","10.1109/MED.2010.5547777","https://www.scopus.com/inward/record.uri?eid=2-s2.0-77957001488&doi=10.1109%2fMED.2010.5547777&partnerID=40&md5=02d22415f931bfa6d6f38a819d342366","In this paper we present the Portfolio Optimization Problem in the electricity generation framework. We consider traditional and fully controllable energy sources together with wind source, strongly supported by economical benefits but exposed to intermittent generation volatility. A new formulation in terms of uNPV (unit Net Present Value) is proposed and analysed, due to the statistical uncertainty about parameters, we formalize the optimization problem in a probabilistic sense in terms of Monte Carlo Estimators and structured in terms of Risk Aversion factor. The optimization routine is implemented with a Genetic Algorithm. © 2010 IEEE.","Generation company; Genetic algorithms; Monte carlo estimators; Portfolio; Unit net present value","Electric generators; Estimation; Financial data processing; Monte Carlo methods; Optimization; Uncertainty analysis; Wind power; Economical benefits; Electricity generation; Energy source; Generation companies; Generation portfolios; Monte Carlo Estimators; Net present value; Optimization problems; Optimization routine; Portfolio; Portfolio optimization; Risk aversion; Statistical uncertainty; Unit net present value; Genetic algorithms","Conference paper","Final","","Scopus","2-s2.0-77957001488"
